{
  "$schema": "./registry.generated.schema.json",
  "version": 1,
  "comment": "Generated by cmd/compatgen — do not hand-edit; `make generate-compat-model` rewrites this file wholly from compat/model/scenarios/. Every loader concatenates it with registry.json, which stays the reviewable hand-written half. A group appears here only while at least one suite has a scenario backend (the scenarioBackends table in cmd/compatgen/registry.go), because `suites` is derived from backend availability and must not be empty; until then the file stays empty and must leave every gate, report and dashboard behaving exactly as before it existed. See docs/plans/compat-coverage-modelgen.md § 3.6.",
  "ported": [
    {
      "group": "appconfig-applications",
      "scenario": "compat/model/authored/appconfig-applications.json",
      "suites": [
        "cli",
        "dotnet-sdk",
        "go-sdk",
        "java-sdk",
        "node-js-sdk",
        "python-sdk",
        "rust-sdk"
      ]
    },
    {
      "group": "appconfig-configuration-profiles",
      "scenario": "compat/model/authored/appconfig-configuration-profiles.json",
      "suites": [
        "cli",
        "dotnet-sdk",
        "go-sdk",
        "java-sdk",
        "node-js-sdk",
        "python-sdk",
        "rust-sdk"
      ]
    },
    {
      "group": "appconfig-deployment-strategies",
      "scenario": "compat/model/authored/appconfig-deployment-strategies.json",
      "suites": [
        "cli",
        "dotnet-sdk",
        "go-sdk",
        "java-sdk",
        "node-js-sdk",
        "python-sdk",
        "rust-sdk"
      ]
    },
    {
      "group": "appconfig-deployments",
      "scenario": "compat/model/authored/appconfig-deployments.json",
      "suites": [
        "cli",
        "dotnet-sdk",
        "go-sdk",
        "java-sdk",
        "node-js-sdk",
        "python-sdk",
        "rust-sdk"
      ]
    },
    {
      "group": "appconfig-environments",
      "scenario": "compat/model/authored/appconfig-environments.json",
      "suites": [
        "cli",
        "dotnet-sdk",
        "go-sdk",
        "java-sdk",
        "node-js-sdk",
        "python-sdk",
        "rust-sdk"
      ]
    },
    {
      "group": "appconfig-experiments",
      "scenario": "compat/model/authored/appconfig-experiments.json",
      "suites": [
        "cli",
        "go-sdk",
        "java-sdk",
        "node-js-sdk",
        "python-sdk",
        "rust-sdk"
      ]
    },
    {
      "group": "appconfig-extensions",
      "scenario": "compat/model/authored/appconfig-extensions.json",
      "suites": [
        "cli",
        "dotnet-sdk",
        "go-sdk",
        "java-sdk",
        "node-js-sdk",
        "python-sdk",
        "rust-sdk"
      ]
    },
    {
      "group": "appconfig-tags",
      "scenario": "compat/model/authored/appconfig-tags.json",
      "suites": [
        "cli",
        "dotnet-sdk",
        "go-sdk",
        "java-sdk",
        "node-js-sdk",
        "python-sdk",
        "rust-sdk"
      ]
    },
    {
      "group": "backup-selections",
      "scenario": "compat/model/authored/backup-selections.json",
      "suites": [
        "cli",
        "dotnet-sdk",
        "go-sdk",
        "java-sdk",
        "node-js-sdk",
        "python-sdk",
        "rust-sdk"
      ]
    },
    {
      "group": "backup-tags",
      "scenario": "compat/model/authored/backup-tags.json",
      "suites": [
        "cli",
        "dotnet-sdk",
        "go-sdk",
        "java-sdk",
        "node-js-sdk",
        "python-sdk",
        "rust-sdk"
      ]
    },
    {
      "group": "cognito-userpools",
      "scenario": "compat/model/authored/cognito-userpools.json",
      "suites": [
        "cli",
        "dotnet-sdk",
        "go-sdk",
        "java-sdk",
        "node-js-sdk",
        "python-sdk",
        "rust-sdk"
      ]
    },
    {
      "group": "ecr-policies",
      "scenario": "compat/model/authored/ecr-policies.json",
      "suites": [
        "cli",
        "dotnet-sdk",
        "go-sdk",
        "java-sdk",
        "node-js-sdk",
        "python-sdk",
        "rust-sdk"
      ]
    },
    {
      "group": "ecr-registry",
      "scenario": "compat/model/authored/ecr-registry.json",
      "suites": [
        "cli",
        "dotnet-sdk",
        "go-sdk",
        "java-sdk",
        "node-js-sdk",
        "python-sdk",
        "rust-sdk"
      ]
    },
    {
      "group": "ecr-tags",
      "scenario": "compat/model/authored/ecr-tags.json",
      "suites": [
        "cli",
        "dotnet-sdk",
        "go-sdk",
        "java-sdk",
        "node-js-sdk",
        "python-sdk",
        "rust-sdk"
      ]
    },
    {
      "group": "eventbridge-buses",
      "scenario": "compat/model/authored/eventbridge-buses.json",
      "suites": [
        "cli",
        "dotnet-sdk",
        "go-sdk",
        "java-sdk",
        "node-js-sdk",
        "python-sdk",
        "rust-sdk"
      ]
    },
    {
      "group": "eventbridge-events",
      "scenario": "compat/model/authored/eventbridge-events.json",
      "suites": [
        "cli",
        "dotnet-sdk",
        "go-sdk",
        "java-sdk",
        "node-js-sdk",
        "python-sdk",
        "rust-sdk"
      ]
    },
    {
      "group": "eventbridge-rules",
      "scenario": "compat/model/authored/eventbridge-rules.json",
      "suites": [
        "cli",
        "dotnet-sdk",
        "go-sdk",
        "java-sdk",
        "node-js-sdk",
        "python-sdk",
        "rust-sdk"
      ]
    },
    {
      "group": "iam-groups",
      "scenario": "compat/model/authored/iam-groups.json",
      "suites": [
        "cli",
        "dotnet-sdk",
        "go-sdk",
        "java-sdk",
        "node-js-sdk",
        "python-sdk",
        "rust-sdk"
      ]
    },
    {
      "group": "iam-policies",
      "scenario": "compat/model/authored/iam-policies.json",
      "suites": [
        "cli",
        "dotnet-sdk",
        "go-sdk",
        "java-sdk",
        "node-js-sdk",
        "python-sdk",
        "rust-sdk"
      ]
    },
    {
      "group": "iam-roles",
      "scenario": "compat/model/authored/iam-roles.json",
      "suites": [
        "cli",
        "dotnet-sdk",
        "go-sdk",
        "java-sdk",
        "node-js-sdk",
        "python-sdk",
        "rust-sdk"
      ]
    },
    {
      "group": "iam-simulate",
      "scenario": "compat/model/authored/iam-simulate.json",
      "suites": [
        "cli",
        "dotnet-sdk",
        "go-sdk",
        "java-sdk",
        "node-js-sdk",
        "python-sdk",
        "rust-sdk"
      ]
    },
    {
      "group": "iam-users",
      "scenario": "compat/model/authored/iam-users.json",
      "suites": [
        "cli",
        "dotnet-sdk",
        "go-sdk",
        "java-sdk",
        "node-js-sdk",
        "python-sdk",
        "rust-sdk"
      ]
    },
    {
      "group": "kinesis-records",
      "scenario": "compat/model/authored/kinesis-records.json",
      "suites": [
        "cli",
        "dotnet-sdk",
        "go-sdk",
        "java-sdk",
        "node-js-sdk",
        "python-sdk",
        "rust-sdk"
      ]
    },
    {
      "group": "kinesis-shards",
      "scenario": "compat/model/authored/kinesis-shards.json",
      "suites": [
        "cli",
        "dotnet-sdk",
        "go-sdk",
        "java-sdk",
        "node-js-sdk",
        "python-sdk",
        "rust-sdk"
      ]
    },
    {
      "group": "kinesis-streams",
      "scenario": "compat/model/authored/kinesis-streams.json",
      "suites": [
        "cli",
        "dotnet-sdk",
        "go-sdk",
        "java-sdk",
        "node-js-sdk",
        "python-sdk",
        "rust-sdk"
      ]
    },
    {
      "group": "logs-events",
      "scenario": "compat/model/authored/logs-events.json",
      "suites": [
        "cli",
        "dotnet-sdk",
        "go-sdk",
        "java-sdk",
        "node-js-sdk",
        "python-sdk",
        "rust-sdk"
      ]
    },
    {
      "group": "logs-groups",
      "scenario": "compat/model/authored/logs-groups.json",
      "suites": [
        "cli",
        "dotnet-sdk",
        "go-sdk",
        "java-sdk",
        "node-js-sdk",
        "python-sdk",
        "rust-sdk"
      ]
    },
    {
      "group": "logs-metric-filters",
      "scenario": "compat/model/authored/logs-metric-filters.json",
      "suites": [
        "cli",
        "dotnet-sdk",
        "go-sdk",
        "java-sdk",
        "node-js-sdk",
        "python-sdk",
        "rust-sdk"
      ]
    },
    {
      "group": "s3tables-tables",
      "scenario": "compat/model/authored/s3tables-tables.json",
      "suites": [
        "cli",
        "dotnet-sdk",
        "go-sdk",
        "java-sdk",
        "node-js-sdk",
        "python-sdk",
        "rust-sdk"
      ]
    },
    {
      "group": "sqs-queues",
      "scenario": "compat/model/authored/sqs-queues.json",
      "suites": [
        "cli",
        "dotnet-sdk",
        "go-sdk",
        "java-sdk",
        "node-js-sdk",
        "python-sdk",
        "rust-sdk"
      ]
    }
  ],
  "groups": [
    {
      "service": "batch",
      "name": "batch-gen-computeenvironment",
      "generated": true,
      "scenario": "compat/model/scenarios/batch.json",
      "state": "candidate",
      "suites": [
        "cli",
        "dotnet-sdk",
        "go-sdk",
        "java-sdk",
        "node-js-sdk",
        "python-sdk",
        "rust-sdk"
      ],
      "tests": [
        {
          "name": "CreateComputeEnvironment"
        },
        {
          "name": "DescribeComputeEnvironments",
          "depends": [
            "CreateComputeEnvironment"
          ]
        },
        {
          "name": "UpdateComputeEnvironment",
          "depends": [
            "CreateComputeEnvironment"
          ]
        },
        {
          "name": "TagResource",
          "depends": [
            "CreateComputeEnvironment"
          ]
        },
        {
          "name": "ListTagsForResource",
          "depends": [
            "CreateComputeEnvironment"
          ]